{
  "$schema": "urn:fortress:derived:v2:local-quality-certificate",
  "schema_version": 2,
  "semantic_version": "quality-certificate-v2.2",
  "project": "PF-FORTRESS",
  "profile": "fortress-complete-local-v1",
  "claim": "LOCAL_QUALITY_GATES_PASS",
  "trust": {
    "level": "untrusted-local",
    "tamper_evidence": "SHA-256",
    "authenticity": "UNVERIFIED",
    "limitation": "Digest stamps detect mutation and staleness but are not signatures; authenticated antiforgery requires an external trusted signing identity."
  },
  "source": {
    "fingerprint": "sha256:2a89e33e67ea828a107b419eafd193fba60c1a818a9447a94c8899952146c74f",
    "file_count": 435,
    "excluded_self": "_info/quality_certificate.json",
    "excluded_derived_artifacts": [
      "_info/behavioral_flow_graph.json",
      "_info/certification.json",
      "_info/component_resolution_index.json",
      "_info/contract_coherency_graph.json",
      "_info/environmental_analysis.json",
      "_info/evidence_graph.json",
      "_info/information_flow_analysis.json",
      "_info/program_semantic_model.json",
      "_info/realized_behavioral_flow_graph.json",
      "_info/semantic_analysis.json",
      "_info/semantic_conformance.json",
      "_info/source_artifact_model.json",
      "_info/state_effect_analysis.json",
      "_info/verified_behavioral_flow_graph.json"
    ]
  },
  "toolchain": {
    "rust": "1.97.1",
    "cargo_config": "_data/cargo_config.toml",
    "resolver_lockfile": "_info/Cargo.lock",
    "build_artifacts": "external-temporary-directory",
    "derived_projections": "external-subject-addressed-cache"
  },
  "gates": [
    {
      "id": "ARTIFACT_BFG",
      "status": "PASS",
      "command": "cargo +1.97.1 --config _data/cargo_config.toml run --quiet --all-features --manifest-path _data/Cargo.toml -p fortress-cli -- certify . --format json --evidence-output <machine-local-path> --certification-output <machine-local-path> --verified-bfg-output <machine-local-path> --projection-output-dir <machine-local-path> --audit-output <machine-local-path>"
    },
    {
      "id": "ARTIFACT_CCG",
      "status": "PASS",
      "command": "cargo +1.97.1 --config _data/cargo_config.toml run --quiet --all-features --manifest-path _data/Cargo.toml -p fortress-cli -- certify . --format json --evidence-output <machine-local-path> --certification-output <machine-local-path> --verified-bfg-output <machine-local-path> --projection-output-dir <machine-local-path> --audit-output <machine-local-path>"
    },
    {
      "id": "ARTIFACT_CERTIFICATION",
      "status": "PASS",
      "command": "cargo +1.97.1 --config _data/cargo_config.toml run --quiet --all-features --manifest-path _data/Cargo.toml -p fortress-cli -- certify . --format json --evidence-output <machine-local-path> --certification-output <machine-local-path> --verified-bfg-output <machine-local-path> --projection-output-dir <machine-local-path> --audit-output <machine-local-path>"
    },
    {
      "id": "ARTIFACT_ENVIRONMENTAL",
      "status": "PASS",
      "command": "cargo +1.97.1 --config _data/cargo_config.toml run --quiet --all-features --manifest-path _data/Cargo.toml -p fortress-cli -- certify . --format json --evidence-output <machine-local-path> --certification-output <machine-local-path> --verified-bfg-output <machine-local-path> --projection-output-dir <machine-local-path> --audit-output <machine-local-path>"
    },
    {
      "id": "ARTIFACT_EVIDENCE_GRAPH",
      "status": "PASS",
      "command": "cargo +1.97.1 --config _data/cargo_config.toml run --quiet --all-features --manifest-path _data/Cargo.toml -p fortress-cli -- certify . --format json --evidence-output <machine-local-path> --certification-output <machine-local-path> --verified-bfg-output <machine-local-path> --projection-output-dir <machine-local-path> --audit-output <machine-local-path>"
    },
    {
      "id": "ARTIFACT_INFORMATION_FLOW",
      "status": "PASS",
      "command": "cargo +1.97.1 --config _data/cargo_config.toml run --quiet --all-features --manifest-path _data/Cargo.toml -p fortress-cli -- certify . --format json --evidence-output <machine-local-path> --certification-output <machine-local-path> --verified-bfg-output <machine-local-path> --projection-output-dir <machine-local-path> --audit-output <machine-local-path>"
    },
    {
      "id": "ARTIFACT_PSM",
      "status": "PASS",
      "command": "cargo +1.97.1 --config _data/cargo_config.toml run --quiet --all-features --manifest-path _data/Cargo.toml -p fortress-cli -- certify . --format json --evidence-output <machine-local-path> --certification-output <machine-local-path> --verified-bfg-output <machine-local-path> --projection-output-dir <machine-local-path> --audit-output <machine-local-path>"
    },
    {
      "id": "ARTIFACT_REALIZED_BFG",
      "status": "PASS",
      "command": "cargo +1.97.1 --config _data/cargo_config.toml run --quiet --all-features --manifest-path _data/Cargo.toml -p fortress-cli -- certify . --format json --evidence-output <machine-local-path> --certification-output <machine-local-path> --verified-bfg-output <machine-local-path> --projection-output-dir <machine-local-path> --audit-output <machine-local-path>"
    },
    {
      "id": "ARTIFACT_REFERENCES",
      "status": "PASS",
      "command": "cargo +1.97.1 --config _data/cargo_config.toml run --quiet --all-features --manifest-path _data/Cargo.toml -p fortress-cli -- certify . --format json --evidence-output <machine-local-path> --certification-output <machine-local-path> --verified-bfg-output <machine-local-path> --projection-output-dir <machine-local-path> --audit-output <machine-local-path>"
    },
    {
      "id": "ARTIFACT_SEMANTIC",
      "status": "PASS",
      "command": "cargo +1.97.1 --config _data/cargo_config.toml run --quiet --all-features --manifest-path _data/Cargo.toml -p fortress-cli -- certify . --format json --evidence-output <machine-local-path> --certification-output <machine-local-path> --verified-bfg-output <machine-local-path> --projection-output-dir <machine-local-path> --audit-output <machine-local-path>"
    },
    {
      "id": "ARTIFACT_SEMANTIC_CONFORMANCE",
      "status": "PASS",
      "command": "cargo +1.97.1 --config _data/cargo_config.toml run --quiet --all-features --manifest-path _data/Cargo.toml -p fortress-cli -- certify . --format json --evidence-output <machine-local-path> --certification-output <machine-local-path> --verified-bfg-output <machine-local-path> --projection-output-dir <machine-local-path> --audit-output <machine-local-path>"
    },
    {
      "id": "ARTIFACT_SOURCE_ARTIFACTS",
      "status": "PASS",
      "command": "cargo +1.97.1 --config _data/cargo_config.toml run --quiet --all-features --manifest-path _data/Cargo.toml -p fortress-cli -- certify . --format json --evidence-output <machine-local-path> --certification-output <machine-local-path> --verified-bfg-output <machine-local-path> --projection-output-dir <machine-local-path> --audit-output <machine-local-path>"
    },
    {
      "id": "ARTIFACT_STATE_EFFECT",
      "status": "PASS",
      "command": "cargo +1.97.1 --config _data/cargo_config.toml run --quiet --all-features --manifest-path _data/Cargo.toml -p fortress-cli -- certify . --format json --evidence-output <machine-local-path> --certification-output <machine-local-path> --verified-bfg-output <machine-local-path> --projection-output-dir <machine-local-path> --audit-output <machine-local-path>"
    },
    {
      "id": "ARTIFACT_VERIFIED_BFG",
      "status": "PASS",
      "command": "cargo +1.97.1 --config _data/cargo_config.toml run --quiet --all-features --manifest-path _data/Cargo.toml -p fortress-cli -- certify . --format json --evidence-output <machine-local-path> --certification-output <machine-local-path> --verified-bfg-output <machine-local-path> --projection-output-dir <machine-local-path> --audit-output <machine-local-path>"
    },
    {
      "id": "AUDIT_JSON_DETERMINISM",
      "status": "PASS",
      "command": "cargo +1.97.1 --config _data/cargo_config.toml run --quiet --all-features --manifest-path _data/Cargo.toml -p fortress-cli -- certify . --format json --evidence-output <machine-local-path> --certification-output <machine-local-path> --verified-bfg-output <machine-local-path> --projection-output-dir <machine-local-path> --audit-output <machine-local-path>"
    },
    {
      "id": "CLIPPY",
      "status": "PASS",
      "command": "cargo +1.97.1 --config _data/cargo_config.toml clippy --manifest-path _data/Cargo.toml --workspace --all-targets --all-features -- -D warnings"
    },
    {
      "id": "DERIVED_ARTIFACT_STORAGE",
      "status": "PASS",
      "command": "python engine/snapshot_governance/testing/_code/derived_artifact_storage.py"
    },
    {
      "id": "EXECUTION_STORAGE",
      "status": "PASS",
      "command": "python engine/snapshot_governance/testing/_code/execution_storage.py"
    },
    {
      "id": "FORMAT",
      "status": "PASS",
      "command": "cargo +1.97.1 --config _data/cargo_config.toml fmt --manifest-path _data/Cargo.toml --all --check"
    },
    {
      "id": "FULL_PROFILE_CERTIFICATION",
      "status": "PASS",
      "command": "cargo +1.97.1 --config _data/cargo_config.toml run --quiet --all-features --manifest-path _data/Cargo.toml -p fortress-cli -- certify . --format json --evidence-output <machine-local-path> --certification-output <machine-local-path> --verified-bfg-output <machine-local-path> --projection-output-dir <machine-local-path> --audit-output <machine-local-path>"
    },
    {
      "id": "PROJECT_FILING_SYSTEM",
      "status": "PASS",
      "command": "cargo +1.97.1 --config _data/cargo_config.toml test --manifest-path _data/Cargo.toml --all-features --test filing_system --test repo_module_001 --test repo_docs_001"
    },
    {
      "id": "RUSTDOC",
      "status": "PASS",
      "command": "cargo +1.97.1 --config _data/cargo_config.toml doc --manifest-path _data/Cargo.toml --workspace --all-features --no-deps"